<?xml version="1.0" encoding="UTF-8"?>
<exercicio
 xmlns="exercicio"
 xmlns:xsi="exercicio"
 xsi:schemaLocation="/home/eduardo/Desktop/dominio/src/dominio/exercicio.xsd">
		
		<conteudo> fila </conteudo>	
		<idEx> f006 </idEx>
		<nivel> facil </nivel>
		<tipo> me </tipo>
		<preReq> </preReq>

		<enunciado> 
			<texto> Como é representada uma Fila estática? </texto>
	 	</enunciado>

		<alternativa> 
			<texto> Usando apenas uma estrutura (struct) </texto>
		</alternativa>
		
		<alternativa> 
			<texto> Usando matriz </texto>	
		</alternativa>
		
		<alternativa valor="true"> 
			<texto> Usando vetor </texto>	
		</alternativa>
		
		<alternativa> 
			<texto> Nenhuma das anteriores </texto>	
		</alternativa>

		<resposta> </resposta>

</exercicio>

