<?xml version="1.0" encoding="UTF-8"?>
<exercicio
 xmlns="exercicio"
 xmlns:xsi="exercicio"
 xsi:schemaLocation="/home/eduardo/Desktop/dominio/src/dominio/exercicio.xsd">
		
		<conteudo>vetor</conteudo>	
		<idEx>v005</idEx>
		<nivel>facil</nivel>
		<tipo>me</tipo>

		<enunciado> 
			<texto> Tenho o seguinte código: </texto> 
			<codigo>for(i=0; i&lt;5; i++) Vetor[i] = i+2 </codigo> 
			<texto> O que esse código faz? </texto> 
                        
		</enunciado>

		<alternativa> 
			<texto> Preenche o Vetor com o número 1. </texto>
		</alternativa>
		
		<alternativa> 
			<texto> Preenche o Vetor de 1 à 5. </texto>	
		</alternativa>
		
		<alternativa> 
			<texto> Preenche o Vetor com número 0. </texto>
		</alternativa>
		
		<alternativa valor="true"> 
			<texto> Nenhuma das alternativas anteriores. </texto>
		</alternativa>

		<resposta> </resposta>

</exercicio>


