<?xml version="1.0" encoding="UTF-8"?>
<exercicio
 xmlns="exercicio"
 xmlns:xsi="exercicio"
 xsi:schemaLocation="/src/dominio/exercicio.xsd">
		
		<disciplina>INF41</disciplina>
		<conteudo>alocDin</conteudo>
		<idEx>ad009</idEx>
		<nivel>facil</nivel>
		<tipo>me</tipo>
		<preReq>
			<req>vetor</req>
		</preReq>

		<enunciado> 
			<texto>Que função em C é capaz de limpar a memória alocada de um vetor V?</texto>
		</enunciado>
		
		<resposta> </resposta>

		<alternativa valor="false"> 
			<codigo highlight="yes">alloc(V)</codigo>
		</alternativa>
		
		<alternativa valor="false"> 
			<codigo highlight="yes">malloc(V)</codigo>	
		</alternativa>
		
		<alternativa valor="false"> 
			<codigo highlight="yes">sizeof(V)</codigo>	
		</alternativa>
		
		<alternativa valor="true"> 
			<codigo highlight="yes">free(V)</codigo>	
		</alternativa>

</exercicio>

