<?xml version="1.0" encoding="UTF-8"?>
<exercicio
 xmlns="exercicio"
 xmlns:xsi="exercicio"
 xsi:schemaLocation="/src/dominio/exercicio.xsd">
		
		<disciplina>INF41</disciplina>
		<conteudo>vetor</conteudo>	
		<idEx>v009</idEx>
		<nivel>facil</nivel>
		<tipo>me</tipo>
		<preReq>
			<req></req>
		</preReq>

		<enunciado> 
			<texto>Dado um vetor B definido com:</texto>
			<codigo>int B[20];</codigo>
			<texto>como preenchê-lo com números inteiros 1, 2, 3, ..., 20.</texto> 
		</enunciado>
		
		<resposta> </resposta>

		<alternativa valor="false"> 
			<codigo highlight="yes">for (int i = 0; i &lt;= 20; i++) A[i] = i;</codigo>
		</alternativa>
		
		<alternativa valor="false"> 
			<codigo highlight="yes">for (int i = 0; i &lt; 19; i++) A[i] = i;</codigo>	
		</alternativa>
		
		<alternativa valor="false"> 
			<codigo highlight="yes">for (int i = 1; i &lt; 19; i++) A[i] = i;</codigo>	
		</alternativa>
		
		<alternativa valor="true"> 
			<codigo highlight="yes">for (int i = 1; i &lt;= 20; i++) A[i-1] = i</codigo>	
		</alternativa>

</exercicio>

