<?xml version="1.0" encoding="UTF-8"?>
<exercicio
 xmlns="exercicio"
 xmlns:xsi="exercicio"
 xsi:schemaLocation="/src/dominio/exercicio.xsd">
		
		<conteudo>lista</conteudo>	
		<idEx>l006</idEx>
		<nivel>facil</nivel>
		<tipo>me</tipo>
		<preReq>alocacao dinamica, vetor, fila, pilha, metodos pesquisa</preReq>

		<enunciado> 
			<texto>A seguinte estrutura é definida em C:</texto>
			<codigo>struct n{ int info; struct node *next;};</codigo>
        	<texto>O que esta estrutura representa?</texto>
	 	</enunciado>
	 	
	 	<resposta> </resposta>

		<alternativa valor="false"> 
			<texto>Um nó para representar uma lista estática</texto>
		</alternativa>
		
		<alternativa valor="false"> 
			<texto>Um nó para representar uma lista dinâmica</texto>	
		</alternativa>
		
		<alternativa valor="false"> 
			<texto>O maior elemento de uma lista e seu próximo</texto>	
		</alternativa>
		
		<alternativa valor="true"> 
			<texto>Remove o primeiro elemento</texto>	
		</alternativa>

</exercicio>

