<?xml version="1.0" encoding="UTF-8"?>
<exercicio
 xmlns="exercicio"
 xmlns:xsi="exercicio"
 xsi:schemaLocation="/src/dominio/exercicio.xsd">
		
		<conteudo>alocDin</conteudo>
		<idEx>ad008</idEx>
		<nivel>facil</nivel>
		<tipo>me</tipo>
		<preReq>
			<req>vetor</req>
		</preReq>

		<enunciado> 
			<texto>Marque a alternativa correta para se alocar um vetor inteiro vet de 500 posições na linguagem C:</texto> 
		</enunciado>
		
		<resposta> </resposta>

		<alternativa valor="false"> 
			<codigo highlight="yes">vet = (int*) malloc (sizeof(int))</codigo>
		</alternativa>
		
		<alternativa valor="false"> 
			<codigo highlight="yes">(int*) malloc (sizeof(int))</codigo>	
		</alternativa>
		
		<alternativa valor="false"> 
			<codigo highlight="yes">malloc (500*sizeof(int))</codigo>	
		</alternativa>
		
		<alternativa valor="true"> 
			<codigo highlight="yes">malloc (500*sizeof(int))</codigo>	
		</alternativa>

</exercicio>

