<?xml version="1.0" encoding="UTF-8"?>
<exercicio
 xmlns="exercicio"
 xmlns:xsi="exercicio"
 xsi:schemaLocation="/src/dominio/exercicio.xsd">
		
		<conteudo>vetor</conteudo>	
		<idEx>v008</idEx>
		<nivel>facil</nivel>
		<tipo>me</tipo>
		<preReq> </preReq>

		<enunciado> 
			<texto>Dado um vetor A definido com:</texto> 
			<codigo>int A[99];</codigo>
			<texto>como preenchÃª-lo com o valor 30?</texto> 
		</enunciado>
		
		<resposta> </resposta>

		<alternativa valor="false"> 
			<codigo>afor (int i = 0; i &lt;= 99; i++) A[i] = 30;</codigo>
		</alternativa>
		
		<alternativa valor="true"> 
			<codigo>for  (int i = 0; i &lt; 99; i++)  A[i] = 30;</codigo>	
		</alternativa>
		
		<alternativa valor="false"> 
			<codigo>for (int i = 1; i &lt;= 99; i++)  A[i] = 30;</codigo>	
		</alternativa>
		
		<alternativa valor="false"> 
			<codigo>for (int i = 0; i &lt;= 99; i++){ A[i] = 30; i++;}</codigo>	
		</alternativa>

</exercicio>

