<?xml version="1.0" encoding="UTF-8"?>
<exercicio
 xmlns="exercicio"
 xmlns:xsi="exercicio"
 xsi:schemaLocation="/src/dominio/exercicio.xsd">

		<disciplina>GSI002</disciplina>
		<conteudo>vetor</conteudo>	
		<idEx>v003</idEx>
		<nivel>facil</nivel>
		<tipo>me</tipo>
		<preReq>
			<req></req>
		</preReq>

		<enunciado> 
			<texto>Qual código a seguir percorre o vetor de caracteres de 4 posições, imprimindo cada item:</texto> 
		</enunciado>
		
		<resposta> </resposta>

		<alternativa valor="false"> 
			<codigo highlight="yes">for(i = 0, i &lt;= 4, i++)  printf(%d, vetor[i]);</codigo>
		</alternativa>
		
		<alternativa valor="false"> 
			<codigo highlight="yes">for(i = 0; i &lt; 4, i++)  printf(&quot;%d&quot;,vetor[i]);</codigo>	
		</alternativa>
		
		<alternativa valor="true"> 
			<codigo highlight="yes">for(i = 0; i &lt; 4, i++)  printf(%c,vetor[i]);</codigo>	
		</alternativa>
		
		<alternativa valor="false"> 
			<texto>Nenhuma das anteriores.</texto>
		</alternativa>

</exercicio>

