<?xml version="1.0" encoding="UTF-8"?>
<exercicio
 xmlns="exercicio"
 xmlns:xsi="exercicio"
 xsi:schemaLocation="/home/eduardo/Desktop/dominio/src/dominio/exercicio.xsd">
		
		<conteudo> alocacao dinamica </conteudo>	
		<idEx> ad010 </idEx>
		<nivel> facil </nivel>
		<tipo> me </tipo>
		<preReq> </preReq>

		<enunciado>
			<codigo>  
			int Func(vet) 
			{ 
				vet = (int*) malloc (sizeof(int)); 
				if(vet == NULL) 
					return 0 
				else 
					return 1 
			}
			</codigo>
			<texto> O que o c√≥digo faz ? </texto>
		</enunciado>

		<alternativa> 
			<texto> aloca um vetor e retorna seu valor </texto>
		</alternativa>
		
		<alternativa> 
			<texto>  aloca e depois limpa a memoria </texto>	
		</alternativa>
		
		<alternativa valor="true"> 
			<texto> aloca e verifica se deu certo </texto>
		</alternativa>
		
		<alternativa> 
			<texto> Nenhuma das anteriores </texto>	
		</alternativa>
		

		<resposta> </resposta>

</exercicio>

