<?xml version="1.0" encoding="UTF-8"?>
<exercicio
 xmlns="exercicio"
 xmlns:xsi="exercicio"
 xsi:schemaLocation="/home/eduardo/Desktop/dominio/src/dominio/exercicio.xsd">
		
		<conteudo> fila </conteudo>	
		<idEx> f002 </idEx>
		<nivel> facil </nivel>
		<tipo> me </tipo>
		<preReq> </preReq>
		
		<enunciado valor="true"> 
			<texto> Como uma fila pode ser representada em C? </texto>
		</enunciado>

		<alternativa> 
			<texto> Vetor, Lista (mudando as propriedades) </texto>
		</alternativa>
		
		<alternativa> 
			<texto> Struct, pilha </texto>
		</alternativa>
		
		<alternativa> 
			<texto> SÃ³ vetor </texto>
		</alternativa>
		
		<alternativa> 
			<texto> Nenhuma das anteriores </texto>
		</alternativa>

		<resposta> </resposta>

</exercicio>


